{
  "$schema": "../../cursor-pack.schema.json",
  "name": "node-test-verifier",
  "version": "0.2.0",
  "description": "Cursor pack with a reusable Node and Jest test-verifier subagent plus project guidance for low-noise, pass-fail-first verification with explicit evidence and optional coverage.",
  "author": "felipeblassioli",
  "targets": [
    "project-cursor",
    "user-cursor"
  ],
  "profiles": {
    "lite": {
      "description": "Installs the reusable test-verifier subagent and documentation without persistent project rules."
    },
    "strict": {
      "description": "Installs the same subagent plus project-only guidance for tier selection, prerequisite checks, pass-fail-first summaries, and repo-local verifier contracts."
    }
  },
  "artifacts": [
    {
      "id": "agents",
      "source": ".cursor/agents",
      "targets": [
        "project-cursor",
        "user-cursor"
      ],
      "profiles": [
        "lite",
        "strict"
      ],
      "projectPath": ".cursor/agents",
      "userPath": "agents"
    },
    {
      "id": "rules",
      "source": ".cursor/rules",
      "targets": [
        "project-cursor"
      ],
      "profiles": [
        "strict"
      ],
      "projectPath": ".cursor/rules",
      "notes": [
        "Strict installs add persistent project guidance for using the verifier after substantive changes.",
        "User installs skip rules because Cursor user rules are managed in settings rather than a ~/.cursor/rules directory."
      ]
    }
  ],
  "install": {
    "defaultProfile": "lite",
    "backupOnConflict": true,
    "stageRoot": ".work/cursor-pack-staging",
    "backupRoot": ".work/cursor-pack-backups",
    "manifestFile": ".cursor-pack-manifest.json",
    "conflictPolicy": "backup-and-overwrite",
    "mcpPolicy": "none"
  }
}
